{
  "lexicon_version": "1.1.0",
  "signal_semantics": {
    "strong": "Result- or method-level concept that may satisfy a load gate after context and entity checks.",
    "supporting": "Corroborating concept that strengthens a route but normally does not load the adapter alone.",
    "weak": "High-recall lexical hint used only to retrieve a candidate adapter.",
    "exclusion": "Concept that identifies a likely false sense, apparatus role, background source, or out-of-scope entity."
  },
  "matching_policy": {
    "surface_terms_are_recall_only": true,
    "semantic_match_required": true,
    "load_requires_entity_binding": true,
    "unresolved_route_status": "candidate",
    "context_order": ["title", "abstract", "methods", "results", "figure-or-table", "conclusion", "references", "future-work"],
    "maintenance_contract": "routing-maintenance-contract.md"
  },
  "adapters": {
    "superconductivity": {
      "ruleset_version": "2.0.0",
      "canonical_label_zh": "超导",
      "canonical_label_en": "Superconductivity",
      "signals": [
        {
          "signal_id": "sc-superconducting-claim",
          "concept": "direct superconducting claim",
          "strength": "strong",
          "terms_en": [
            "superconductivity",
            "superconductor",
            "superconducting behavior",
            "superconducting state",
            "superconducting transition",
            "bulk superconductivity",
            "supercurrent"
          ],
          "terms_zh": [
            "超导",
            "超导体",
            "超导行为",
            "超导态",
            "超导转变",
            "体超导",
            "超电流"
          ],
          "abbreviations": [],
          "symbols": [],
          "valid_contexts": [
            "title",
            "abstract",
            "methods",
            "results",
            "figure-or-table",
            "conclusion"
          ],
          "invalid_contexts": [
            "references",
            "cited-comparison",
            "future-work",
            "negated-claim"
          ],
          "requires_entity_binding": true,
          "independence_group": "sc-claim"
        },
        {
          "signal_id": "sc-zero-resistance",
          "concept": "zero-resistance transport",
          "strength": "strong",
          "terms_en": [
            "zero resistance",
            "zero resistivity",
            "resistance below the noise floor"
          ],
          "terms_zh": [
            "零电阻",
            "零电阻率",
            "电阻低于噪声底"
          ],
          "abbreviations": [],
          "symbols": [
            "R=0",
            "rho=0"
          ],
          "valid_contexts": [
            "title",
            "abstract",
            "methods",
            "results",
            "figure-or-table",
            "conclusion"
          ],
          "invalid_contexts": [
            "references",
            "cited-comparison",
            "future-work",
            "negated-claim"
          ],
          "requires_entity_binding": true,
          "independence_group": "sc-transport"
        },
        {
          "signal_id": "sc-diamagnetic-response",
          "concept": "Meissner or diamagnetic response",
          "strength": "strong",
          "terms_en": [
            "Meissner effect",
            "diamagnetic shielding",
            "flux expulsion"
          ],
          "terms_zh": [
            "迈斯纳效应",
            "抗磁屏蔽",
            "磁通排斥"
          ],
          "abbreviations": [
            "ZFC",
            "FC"
          ],
          "symbols": [],
          "valid_contexts": [
            "title",
            "abstract",
            "methods",
            "results",
            "figure-or-table",
            "conclusion"
          ],
          "invalid_contexts": [
            "references",
            "cited-comparison",
            "future-work",
            "negated-claim"
          ],
          "requires_entity_binding": true,
          "independence_group": "sc-magnetic"
        },
        {
          "signal_id": "sc-thermodynamic-anomaly",
          "concept": "thermodynamic superconducting transition",
          "strength": "supporting",
          "terms_en": [
            "specific-heat jump",
            "heat-capacity anomaly"
          ],
          "terms_zh": [
            "比热跃变",
            "热容异常"
          ],
          "abbreviations": [],
          "symbols": [
            "Delta C"
          ],
          "valid_contexts": [
            "title",
            "abstract",
            "methods",
            "results",
            "figure-or-table",
            "conclusion"
          ],
          "invalid_contexts": [
            "references",
            "cited-comparison",
            "future-work",
            "negated-claim"
          ],
          "requires_entity_binding": true,
          "independence_group": "sc-thermodynamic"
        },
        {
          "signal_id": "sc-characteristic-property",
          "concept": "superconducting characteristic property",
          "strength": "weak",
          "terms_en": [
            "critical field",
            "critical current",
            "superconducting gap",
            "vortex pinning"
          ],
          "terms_zh": [
            "临界场",
            "临界电流",
            "超导能隙",
            "磁通钉扎"
          ],
          "abbreviations": [
            "Hc1",
            "Hc2",
            "Jc"
          ],
          "symbols": [
            "Tc"
          ],
          "valid_contexts": [
            "title",
            "abstract",
            "methods",
            "results",
            "figure-or-table",
            "conclusion"
          ],
          "invalid_contexts": [
            "references",
            "cited-comparison",
            "future-work",
            "negated-claim"
          ],
          "requires_entity_binding": true,
          "independence_group": "sc-property"
        },
        {
          "signal_id": "sc-apparatus-or-other-tc",
          "concept": "apparatus or alternate-symbol use",
          "strength": "exclusion",
          "terms_en": [
            "superconducting magnet",
            "Curie temperature",
            "crystallization temperature"
          ],
          "terms_zh": [
            "超导磁体",
            "居里温度",
            "结晶温度"
          ],
          "abbreviations": [
            "Tc"
          ],
          "symbols": [],
          "valid_contexts": [
            "apparatus",
            "methods",
            "results"
          ],
          "invalid_contexts": [
            "references",
            "cited-comparison",
            "future-work",
            "negated-claim"
          ],
          "requires_entity_binding": false,
          "independence_group": "sc-exclusion"
        }
      ],
      "ambiguous_terms": [
        {
          "term": "Tc",
          "possible_senses": [
            "superconducting transition temperature",
            "Curie temperature",
            "crystallization temperature",
            "critical temperature in another domain"
          ],
          "resolution_rule": "Resolve from the named phenomenon, measurement channel, units, and target entity; the symbol alone is weak."
        },
        {
          "term": "Hc",
          "possible_senses": [
            "thermodynamic critical field",
            "coercive field"
          ],
          "resolution_rule": "Require superconducting context and field-temperature or Meissner evidence."
        },
        {
          "term": "Jc",
          "possible_senses": [
            "critical current density of a superconductor",
            "generic current density"
          ],
          "resolution_rule": "Require an explicit superconducting criterion and geometry or model."
        }
      ],
      "load_gate": {
        "all_of": [
          "source identity is resolved",
          "at least one target entity is resolved",
          "at least one method-level or result-level signal is bound to the target",
          "all positive evidence is not fully explained by exclusion context"
        ],
        "any_of": [
          "an explicit target-bound superconducting claim appears in a result-bearing context",
          "two compatible independent evidence groups support the same target",
          "a theoretical paper explicitly predicts superconductivity for the target and is labeled theoretical"
        ],
        "minimum_independent_groups": 1
      },
      "candidate_gate": [
        "only weak or supporting vocabulary is available",
        "target entity binding is unresolved",
        "the accessible source is insufficient to resolve centrality or polarity",
        "a strong-looking term has an unresolved alternate sense"
      ],
      "skip_gate": [
        "all matches are apparatus, consumable, substrate, container, cited, negated, or future-work mentions",
        "the source is sufficiently complete and the studied target is outside this adapter scope"
      ],
      "co_load_suggestions": [
        "electrical-magnetic-transport",
        "thermal-analysis",
        "quantum-materials",
        "materials-simulation"
      ],
      "reason_codes": {
        "SC-LOAD-TARGET": "Target-bound method or result evidence satisfies the load gate.",
        "SC-CANDIDATE-UNRESOLVED": "Domain possibility exists but binding, polarity, or centrality is unresolved.",
        "SC-SKIP-EXCLUDED": "All matched occurrences are explained by exclusion context."
      }
    },
    "metallic-materials": {
      "ruleset_version": "2.0.0",
      "canonical_label_zh": "金属与合金",
      "canonical_label_en": "Metallic materials",
      "signals": [
        {
          "signal_id": "met-alloy-identity",
          "concept": "metal or alloy identity",
          "strength": "strong",
          "terms_en": [
            "metallic material",
            "metal specimen",
            "printed metal",
            "alloy grade",
            "steel grade",